"remark"	"tag"	"taskid"	"score"	"parentId"	"date"	"QCStateLabel"	"tattoo_chest"	"score_old"	"Id"	"performedby"	"Description"	"tattoo_thigh"	"weightStatus"	"microchip"	"tattoo_remark"	"project"	"account"	"enddate"	"requestid"
"sed condimentum sodales in nisi eget ut id diam lorem quisque lorem ornare mattis in mauris"	""	"4374574b-a1b5-102e-877d-f528764d9dfa"	"4.0"	"4374574a-a1b5-102e-877d-f528764d9dfa"	"2011-07-22 08:51:00.0"	"Completed"	"Absent"	""	"test4551032"	"jcoonen"	"phasellus vivamus scelerisque viverra fermentum sapien nam ipsum tristique quis"	"Poor"	"false"	""	"""0200"" on chest"	"803932"	""	""	""
"maecenas tristique facilisis duis habitant"	""	"bedd479b-a1a8-102e-877d-f528764d9dfa"	"3.0"	"bedd479a-a1a8-102e-877d-f528764d9dfa"	"2011-07-22 09:22:00.0"	"Completed"	"Absent"	""	"test5904521"	"jcoonen"	"nulla ut lacinia iaculis diam aliquam est felis"	"Poor"	"false"	""	""	"803932"	""	""	""
"turpis dictumst eget ullamcorper condimentum"	""	"7cb07c5b-ab08-102e-82cc-f528764d4520"	"4.0"	"7cb07c5a-ab08-102e-82cc-f528764d4520"	"2011-07-12 10:30:00.0"	"Completed"	"Good"	""	"test4564246"	"mharke"	"phasellus felis lacus sodales mauris eros nunc accumsan ac vel sodales id porttitor"	"Good"	"true"	""	""	"803932"	""	""	""
"consectetur porttitor quis ut at diam sit condimentum"	""	"4b7cd6f2-aa42-102e-b651-f528764dd3a5"	"2.5"	"4b7cd6f1-aa42-102e-b651-f528764dd3a5"	"2011-07-11 09:30:00.0"	"Completed"	"Good"	""	"test6390238"	"mharke"	"blandit nam mus aliquam mauris ultricies porta metus"	"Done Today"	"false"	""	""	"803932"	""	""	""
"sodales est ullamcorper"	""	"2d40b63d-af32-102e-8fcd-f528764d9ad7"	"3.0"	"2d40b63c-af32-102e-8fcd-f528764d9ad7"	"2011-08-22 13:00:00.0"	"Completed"	"Good"	""	"test6390238"	"mharke"	"laoreet metus massa lorem arcu eu a urna condimentum"	"Good"	"false"	""	""	"803932"	"6393464"	""	""
"tempus eget torquent"	""	"1513cf23-aa3a-102e-b651-f528764dd3a5"	"3.0"	"1513cf22-aa3a-102e-b651-f528764dd3a5"	"2011-07-11 10:00:00.0"	"Completed"	"Good"	""	"test2008446"	"mharke"	"eu non purus semper semper urna quis gravida vestibulum"	"Done Today"	"false"	""	""	"803932"	""	""	""
"laoreet sapien"	""	"7c3e1928-c069-102e-a229-48cf881b7844"	"3.0"	"7c3e1927-c069-102e-a229-48cf881b7844"	"2011-08-25 10:30:00.0"	"Completed"	"Good"	""	"test2008446"	"mharke"	"netus mauris nibh purus morbi facilisis urna"	"Good"	"false"	""	""	"803932"	""	""	""
"ut enim ut diam nullam egestas cursus non est vel  porttitor"	""	"4b7cd58a-aa42-102e-b651-f528764dd3a5"	"3.0"	"4b7cd589-aa42-102e-b651-f528764dd3a5"	"2011-07-11 09:30:00.0"	"Completed"	"Good"	""	"test499022"	"mharke"	"eu ligula ut justo consectetur molestie integer pulvinar"	"Done Today"	"false"	""	""	"803932"	""	""	""
"donec consectetur"	""	"1513ce1b-aa3a-102e-b651-f528764dd3a5"	"2.5"	"1513ce1a-aa3a-102e-b651-f528764dd3a5"	"2011-07-11 10:00:00.0"	"Completed"	"Good"	""	"test4013108"	"mharke"	"vel rutrum hendrerit in eleifend magnis nulla felis"	"Good"	"false"	""	""	"803932"	""	""	""
"quis lacus egestas consectetur purus malesuada"	""	"1513cbe7-aa3a-102e-b651-f528764dd3a5"	"3.0"	"1513cbe6-aa3a-102e-b651-f528764dd3a5"	"2011-07-11 10:00:00.0"	"Completed"	"Good"	""	"test5292692"	"mharke"	"a faucibus cum pellentesque in quis ac metus"	"Good"	"false"	""	""	"803932"	""	""	""
"id aliquet aenean justo ut eleifend quam"	""	"4b7cce82-aa42-102e-b651-f528764dd3a5"	"2.5"	"4b7cce81-aa42-102e-b651-f528764dd3a5"	"2011-07-11 09:30:00.0"	"Completed"	"Good"	""	"test3771679"	"mharke"	"sit et sapien erat sem arcu dis netus nisi sapien aptent maecenas nec phasellus imperdiet"	"Absent"	"true"	""	""	"803932"	""	""	""
"nisi elementum gravida viverra non a netus vestibulum aliquet hac sem luctus"	""	"4b7cd39a-aa42-102e-b651-f528764dd3a5"	"2.5"	"4b7cd399-aa42-102e-b651-f528764dd3a5"	"2011-07-11 09:30:00.0"	"Completed"	"Good"	""	"test4037096"	"mharke"	"tristique sapien dolor vestibulum placerat integer sed in aenean turpis eget justo elit"	"Done Today"	"true"	""	""	"803932"	""	""	""
"enim vel pharetra"	""	"a97bd0f3-b548-102e-b2c9-f528764d87d0"	"2.5"	"a97bd0f2-b548-102e-b2c9-f528764d87d0"	"2011-07-20 10:15:00.0"	"Completed"	"Good"	""	"test1112911"	"mharke"	"tellus ipsum mattis donec ut integer tristique commodo"	"Absent"	"false"	""	""	"803932"	""	""	""
"nec pulvinar dictum"	""	"a97bd271-b548-102e-b2c9-f528764d87d0"	"2.5"	"a97bd270-b548-102e-b2c9-f528764d87d0"	"2011-07-20 10:00:00.0"	"Completed"	"Good"	""	"test727088"	"mharke"	" quam amet tincidunt arcu quam facilisis dolor nulla"	"Absent"	"false"	""	""	"803932"	""	""	""
"risus proin ante"	""	"a97bcef8-b548-102e-b2c9-f528764d87d0"	"2.5"	"a97bcef7-b548-102e-b2c9-f528764d87d0"	"2011-07-20 10:15:00.0"	"Completed"	"Good"	""	"test3224553"	"mharke"	"dictum fusce placerat pretium pellentesque sagittis"	"Absent"	"false"	""	""	"803932"	""	""	""
"maecenas molestie"	""	"a97bd7b7-b548-102e-b2c9-f528764d87d0"	"2.5"	"a97bd7b6-b548-102e-b2c9-f528764d87d0"	"2011-07-20 10:00:00.0"	"Completed"	"Good"	""	"test3621582"	"mharke"	"amet sed interdum sit vestibulum viverra fermentum"	"Absent"	"false"	""	""	"803932"	""	""	""
"et dolor et ac"	""	"11fe84a1-b0f0-102e-8fcd-f528764d9ad7"	"3.0"	"11fe84a0-b0f0-102e-8fcd-f528764d9ad7"	"2011-07-06 09:49:00.0"	"Completed"	"Done Today"	""	"test6700530"	"jcoonen"	"sit ante purus nulla phasellus convallis vestibulum neque"	"Absent"	"false"	""	""	"803932"	""	""	""
"libero cum eget"	""	"11fe82d1-b0f0-102e-8fcd-f528764d9ad7"	"3.0"	"11fe82d0-b0f0-102e-8fcd-f528764d9ad7"	"2011-07-06 09:46:00.0"	"Completed"	"Absent"	""	"test6208376"	"jcoonen"	"a eget euismod pulvinar nec proin adipiscing turpis"	"Absent"	"false"	""	""	"803932"	""	""	""
""	""	"883f199b-c807-102e-8f24-48cf881babba"	"3.0"	"883f199a-c807-102e-8f24-48cf881babba"	"2011-09-21 11:21:00.0"	"Completed"	"Good"	""	"test6208376"	"jcoonen"	"diam id tempus arcu dui neque mi lorem feugiat"	"Absent"	"false"	""	""	"803932"	""	""	""
"himenaeos tempor"	""	"11fe9921-b0f0-102e-8fcd-f528764d9ad7"	"3.0"	"11fe9920-b0f0-102e-8fcd-f528764d9ad7"	"2011-07-06 08:59:00.0"	"Completed"	"Good"	""	"test9195996"	"jcoonen"	"turpis quis cras ut mauris viverra ipsum vulputate"	"Done Today"	"false"	""	""	"803932"	""	""	""
"in faucibus etiam nulla vestibulum felis primis"	""	"883f27d1-c807-102e-8f24-48cf881babba"	"2.5"	"883f27d0-c807-102e-8f24-48cf881babba"	"2011-09-21 11:09:00.0"	"Completed"	"Good"	""	"test9195996"	"jcoonen"	"quisque mattis eleifend eget sem eros sem gravida"	"Good"	"false"	""	""	"803932"	""	""	""
"id fringilla ut"	""	"11fe9787-b0f0-102e-8fcd-f528764d9ad7"	"3.0"	"11fe9786-b0f0-102e-8fcd-f528764d9ad7"	"2011-07-06 08:59:00.0"	"Completed"	"Good"	""	"test8976544"	"jcoonen"	"nunc ut nulla quis nisl ullamcorper"	""	"false"	""	""	"803932"	""	""	""
"donec vitae at"	""	"4ac3bc5d-c7ea-102e-8f24-48cf881babba"	"3.0"	"4ac3bc5c-c7ea-102e-8f24-48cf881babba"	"2011-09-21 11:01:00.0"	"Completed"	"Good"	""	"test8976544"	"jcoonen"	"et quisque risus magna vestibulum sed maecenas"	"Absent"	"false"	""	""	"803932"	""	""	""
""	""	"9e3b8fe0-aa74-102e-b651-f528764dd3a5"	"3.0"	"9e3b8fdf-aa74-102e-b651-f528764dd3a5"	"2011-07-06 09:02:00.0"	"Completed"	"Good"	""	"test3844307"	"cfitz"	"gravida condimentum augue id et facilisis gravida habitasse"	"Done Today"	"false"	""	""	"803932"	"6393464"	""	""
""	""	"b629f88f-a105-102e-bc38-f528764d1486"	"4.0"	"b629f88e-a105-102e-bc38-f528764d1486"	"2011-07-22 09:15:00.0"	"Completed"	"Absent"	""	"test2312318"	"kflemmen"	"lacinia malesuada sit ad sit molestie  ut auctor"	"Good"	"false"	""	""	"803932"	"6393464"	""	""
